{
  "$schema": "../../../source/schemas/lisa-presentation-pdf-review-manifest.schema.json",
  "version": "1.0.0",
  "frame_id": "lisa-presentation-sber2025",
  "status": "draft_png_rendered_pending_owner_approval",
  "import_mode": "approved_pdf_to_png",
  "source_file_name": "vodoley_dense_sber2025.pdf",
  "source_pdf_sha256": "9dc9ab650fdf24ff87edc1973515fa4baac6fddf8c8a715433207b2ca0c80fcc",
  "source_pdf_page_count": 3,
  "source_pdf_committed_to_git": false,
  "source_path_stored": false,
  "source_svg_required": false,
  "renderer": "swift_coregraphics",
  "draft_scale": 1,
  "draft_png_path": "candidate-evidence/frame-review/lisa-presentation-sber2025-pdf-import/draft-current-resolution.png",
  "draft_png_sha256": "428928dc774aabe428293a082085ade4116b0bef733c46dc0c1c2f84d00d82ab",
  "draft_png_dimensions": {
    "width": 960,
    "height": 1620
  },
  "draft_png_non_white_pixel_count": 346663,
  "active_release_mutation_prohibited": true,
  "owner_frame_approval": null
}
